{
  "schema_version": "1.0",
  "world_id": "WLD-1f591576-f6c4-4c77-a975-08494320662d",
  "task_id": "TSK-90b6e64c-fe5c-429e-961f-a255d86643d9",
  "run_id": "RUN-438e830b-97d6-453c-ae5a-925c56af1a19",
  "canon_version": "CANON-191e98e943d3ff56d7479b8ff0e41e56b729a18a70a24555365a21f0aedb5168",
  "task_path": ".cache/tasks/TSK-90b6e64c-fe5c-429e-961f-a255d86643d9/waiting.json",
  "task_sha256": "951109ac734c7cc5be6677a8953cf719b51ca666bd6e1f400d7df06a1d6d272a",
  "base_git_sha": "0000000000000000000000000000000000000000",
  "base_ref": "refs/heads/main",
  "branch": "canon/RUN-438e830b-97d6-453c-ae5a-925c56af1a19",
  "decision_id": "DEC-001",
  "proposal_hashes": {
    "CHG-9d258c60-ad14-4007-a25b-71d38c1159c2": "83f4a4860fe85a260cff7dd27b4072c96c3709a96ed9614161ac7700e9ac0d0b"
  },
  "created_at": "2026-10-03T12:06:50.937415Z",
  "files": [
    {
      "path": "world/canon/technology/TECH-002.json",
      "before": null,
      "after": {
        "entity_id": "TECH-002",
        "domain": "technology",
        "title": "TEST FIXTURE: open propulsion question",
        "statement": "Structure demonstration only. This is not an author setting or a verified fact.",
        "status": "Open Question",
        "source": {
          "kind": "open_question",
          "description": "Synthetic contract fixture"
        },
        "dependencies": [],
        "implications": [],
        "conflicts": [],
        "evidence_ids": [],
        "claims": [],
        "last_updated": "2026-10-03T12:06:50.937415Z"
      }
    }
  ]
}
